{
  "$schema": "https://json-schema.org/draft/2020-12/schema",
  "$id": "https://yokai-fighters.local/schema/normal.schema.json",
  "title": "Normal",
  "description": "One normal attack (C8) in data/moves/<id>.json: a single button, optionally restricted to some directions, with one level of frame data written from its matched clip (F1, F2). Normals have no levels, card or EX; the move system picks the normal whose button and direction match the parsed command, identically for Kata and Kihon (K3).",
  "type": "object",
  "required": ["kind", "id", "name", "source", "clip", "rules", "input", "frame_data"],
  "additionalProperties": false,
  "dependentRequired": { "landing_recovery": ["air"] },
  "properties": {
    "kind": { "const": "normal" },
    "id": { "$ref": "common.schema.json#/$defs/id" },
    "name": { "type": "string", "minLength": 1 },
    "status": { "$ref": "common.schema.json#/$defs/status" },
    "source": { "$ref": "common.schema.json#/$defs/yokai", "description": "Whose kit the normal belongs to ('ryo' for C8)." },
    "clip": { "$ref": "common.schema.json#/$defs/id", "description": "Clip match id: data/clips/<clip>.json (F2)." },
    "rules": { "$ref": "common.schema.json#/$defs/ruleIds" },
    "input": {
      "type": "object",
      "required": ["button"],
      "additionalProperties": false,
      "properties": {
        "button": {
          "enum": ["LP", "MP", "HP", "LK", "MK", "HK"],
          "description": "The attack button (K1, K2): light/medium/heavy punch and kick."
        },
        "directions": {
          "description": "Numpad directions relative to facing on the press (6 = toward the opponent, 2 = down). Omitted = any direction. A normal that lists the direction wins over one that does not, so a crouching variant can be added later without touching the standing one.",
          "type": "array",
          "minItems": 1,
          "uniqueItems": true,
          "items": { "type": "integer", "minimum": 1, "maximum": 9 }
        }
      }
    },
    "air": {
      "type": "boolean",
      "description": "E11 (YOK-55): a jump-in normal. true = it comes out only while airborne (one per jump) and ends on landing; false or omitted = a ground normal, never used in the air. Air normals are not overheads (E6): standing and crouching guard both block them."
    },
    "landing_recovery": {
      "type": "integer",
      "minimum": 0,
      "maximum": 30,
      "description": "Air normals only: frames the fighter can't act after touching down mid-move (the move ends on landing). Omitted = the engine default (3, designer proposal)."
    },
    "frame_data": { "$ref": "frame-data.schema.json" },
    "notes": { "$ref": "common.schema.json#/$defs/notes" }
  }
}
