{
  "kind": "normal",
  "id": "kitsune-medium-kick",
  "name": "Kitsune medium kick",
  "status": "proposed",
  "source": "kitsune",
  "clip": "kitsune-medium-kick",
  "rules": [
    "C8",
    "F2",
    "E1",
    "E5",
    "V2"
  ],
  "input": {
    "button": "MK"
  },
  "frame_data": {
    "startup": 7,
    "active": 3,
    "recovery": 14,
    "damage": 55,
    "hitstun": 18,
    "blockstun": 14,
    "strength": "medium",
    "hitboxes": [
      {
        "frames": [
          8,
          9
        ],
        "rect": {
          "x": 110,
          "y": 115,
          "w": 85,
          "h": 80
        }
      },
      {
        "frames": [
          10,
          10
        ],
        "rect": {
          "x": 110,
          "y": 175,
          "w": 80,
          "h": 45
        }
      }
    ],
    "hurtboxes": [
      {
        "frames": [
          1,
          24
        ],
        "rect": {
          "x": -35,
          "y": 0,
          "w": 80,
          "h": 310
        }
      },
      {
        "frames": [
          8,
          10
        ],
        "rect": {
          "x": 110,
          "y": 115,
          "w": 85,
          "h": 105
        }
      },
      {
        "frames": [
          11,
          14
        ],
        "rect": {
          "x": 105,
          "y": 185,
          "w": 80,
          "h": 65
        }
      }
    ]
  },
  "notes": "Head-high straight kick (foot at 107 cm = 214 units, hitbox y 150-210), clip 24 frames (1.2x), hit 8-10: 7/3/14 = C8, no deviation. Blend-out: leg back to 40% at the cut, blend the last 4-6 ticks. Standing mid (not low). Hakama tube not added to the hurtbox beyond the leg box. Body hurtbox E5 for the whole move. Hitstun, blockstun and pushback are placeholders (not in rules.md); damage is the C8 number. YOK-33: boxes re-placed from the rigged model poses on their frames (bones at 200 u/m, +pads); frame timing unchanged."
}
