{
  "kind": "normal",
  "id": "kitsune-medium-punch",
  "name": "Kitsune medium punch",
  "status": "proposed",
  "source": "kitsune",
  "clip": "kitsune-medium-punch",
  "rules": [
    "C8",
    "F2",
    "E1",
    "E5",
    "V2"
  ],
  "input": {
    "button": "MP"
  },
  "frame_data": {
    "startup": 6,
    "active": 3,
    "recovery": 12,
    "damage": 50,
    "hitstun": 17,
    "blockstun": 13,
    "strength": "medium",
    "hitboxes": [
      {
        "frames": [
          7,
          9
        ],
        "rect": {
          "x": 45,
          "y": 200,
          "w": 95,
          "h": 40
        }
      }
    ],
    "hurtboxes": [
      {
        "frames": [
          1,
          21
        ],
        "rect": {
          "x": -45,
          "y": 0,
          "w": 90,
          "h": 360
        }
      },
      {
        "frames": [
          7,
          13
        ],
        "rect": {
          "x": 35,
          "y": 200,
          "w": 90,
          "h": 35
        }
      }
    ]
  },
  "notes": "Clip 21 frames (1.25x), hit 7-9: 6/3/12 = C8, no deviation. Blend-out: hand at 72% reach at the cut, blend the last 4-6 ticks. Hurtbox: E5 standing body for the whole move; sleeves not added; bare striking limb box while extended. Hitstun, blockstun and pushback are placeholders on the Ryo fixture scale (not in rules.md); damage is the C8 number."
}
