{
  "kind": "normal",
  "id": "ryo-heavy-kick",
  "name": "Heavy kick",
  "status": "proposed",
  "source": "ryo",
  "clip": "ryo-heavy-kick",
  "rules": [
    "C8",
    "E1",
    "E5",
    "E6",
    "F2",
    "F3",
    "K3",
    "V2"
  ],
  "input": {
    "button": "HK"
  },
  "frame_data": {
    "startup": 11,
    "active": 4,
    "recovery": 23,
    "damage": 90,
    "hitstun": 27,
    "blockstun": 24,
    "hitboxes": [
      {
        "frames": [
          12,
          13
        ],
        "rect": {
          "x": 80,
          "y": 165,
          "w": 85,
          "h": 75
        }
      },
      {
        "frames": [
          14,
          15
        ],
        "rect": {
          "x": 90,
          "y": 220,
          "w": 80,
          "h": 80
        }
      }
    ],
    "hurtboxes": [
      {
        "frames": [
          1,
          38
        ],
        "rect": {
          "x": -85,
          "y": 0,
          "w": 115,
          "h": 345
        }
      },
      {
        "frames": [
          11,
          13
        ],
        "rect": {
          "x": 75,
          "y": 140,
          "w": 90,
          "h": 100
        }
      },
      {
        "frames": [
          14,
          22
        ],
        "rect": {
          "x": 70,
          "y": 205,
          "w": 100,
          "h": 115
        }
      },
      {
        "frames": [
          23,
          26
        ],
        "rect": {
          "x": 70,
          "y": 120,
          "w": 85,
          "h": 110
        }
      },
      {
        "frames": [
          27,
          29
        ],
        "rect": {
          "x": 65,
          "y": 70,
          "w": 65,
          "h": 105
        }
      }
    ],
    "properties": {
      "knockdown": true
    }
  },
  "notes": "Re-derived from the re-timed clip (PR #41): frames_total 38, S/A/R 11/4/23. Foot is still at 66% reach at the cut: blend the retraction out over 6 ticks. Hitstun 27 and blockstun 24 give about +4 on hit and +1 on block (not in rules.md; the harness tunes them). Boxes in units (E1) read from clip stills; the second hurtbox is the extended limb. HEAD-HIGH kick (clip 215 High_Kick, foot at 129-144 cm). The designer asked for a mid kick; the preset library has no mid variant, so this kick hits high: it must be blocked standing and a crouching opponent can duck it (E6). FLAG for the designer. C8 target 12/4/22; clip gives 11/4/23 (clip wins, F2). Knockdown per C8. YOK-33: boxes re-placed from the rigged model poses on their frames (bones at 200 u/m, +pads); frame timing unchanged."
}
