{
  "kind": "normal",
  "id": "ryo-heavy-punch",
  "name": "Heavy punch",
  "status": "proposed",
  "source": "ryo",
  "clip": "ryo-heavy-punch",
  "rules": [
    "C8",
    "E1",
    "E5",
    "F2",
    "F3",
    "K3",
    "V2"
  ],
  "input": {
    "button": "HP"
  },
  "frame_data": {
    "startup": 10,
    "active": 4,
    "recovery": 20,
    "damage": 80,
    "hitstun": 24,
    "blockstun": 21,
    "hitboxes": [
      {
        "frames": [
          11,
          12
        ],
        "rect": {
          "x": 30,
          "y": 185,
          "w": 70,
          "h": 75
        }
      },
      {
        "frames": [
          13,
          14
        ],
        "rect": {
          "x": 35,
          "y": 200,
          "w": 65,
          "h": 75
        }
      }
    ],
    "hurtboxes": [
      {
        "frames": [
          1,
          34
        ],
        "rect": {
          "x": -50,
          "y": 0,
          "w": 90,
          "h": 340
        }
      },
      {
        "frames": [
          10,
          18
        ],
        "rect": {
          "x": 25,
          "y": 175,
          "w": 80,
          "h": 105
        }
      }
    ]
  },
  "notes": "Re-derived from the re-timed clip (PR #41): frames_total 34, S/A/R 10/4/20. Arm is at 74% reach at the cut: blend the retraction out over 4-6 ticks. Hitstun 24 and blockstun 21 give about +4 on hit and +1 on block (not in rules.md; the harness tunes them). Boxes in units (E1) read from clip stills; the second hurtbox is the extended limb. YOK-33: boxes re-placed from the rigged model poses on their frames (bones at 200 u/m, +pads); frame timing unchanged."
}
