{
  "kind": "normal",
  "id": "kitsune-heavy-punch",
  "name": "Kitsune heavy punch",
  "status": "proposed",
  "source": "kitsune",
  "clip": "kitsune-heavy-punch",
  "rules": [
    "C8",
    "F2",
    "E1",
    "E5",
    "V2"
  ],
  "input": {
    "button": "HP"
  },
  "frame_data": {
    "startup": 10,
    "active": 4,
    "recovery": 20,
    "damage": 80,
    "hitstun": 24,
    "blockstun": 18,
    "strength": "heavy",
    "hitboxes": [
      {
        "frames": [
          11,
          13
        ],
        "rect": {
          "x": 35,
          "y": 185,
          "w": 80,
          "h": 80
        }
      },
      {
        "frames": [
          14,
          14
        ],
        "rect": {
          "x": 45,
          "y": 200,
          "w": 70,
          "h": 70
        }
      }
    ],
    "hurtboxes": [
      {
        "frames": [
          1,
          34
        ],
        "rect": {
          "x": -40,
          "y": 5,
          "w": 85,
          "h": 310
        }
      },
      {
        "frames": [
          11,
          18
        ],
        "rect": {
          "x": 35,
          "y": 185,
          "w": 85,
          "h": 95
        }
      }
    ],
    "properties": {
      "anti_air": true
    }
  },
  "notes": "Uppercut clip 34 frames, hit 11-14: 10/4/20 = C8, no deviation. Blend-out: arm at 71% at the cut, blend the last 4-6 ticks. anti_air flag is a proposal from the box shape (hitbox rises to y 320). Body hurtbox E5 for the whole move; bare striking limb box while extended. Hitstun, blockstun and pushback are placeholders (not in rules.md); damage is the C8 number. YOK-33: boxes re-placed from the rigged model poses on their frames (bones at 200 u/m, +pads); frame timing unchanged."
}
