{
  "kind": "normal",
  "id": "kitsune-heavy-kick",
  "name": "Kitsune heavy kick",
  "status": "proposed",
  "source": "kitsune",
  "clip": "kitsune-heavy-kick",
  "rules": [
    "C8",
    "F2",
    "E1",
    "E5",
    "V2"
  ],
  "input": {
    "button": "HK"
  },
  "frame_data": {
    "startup": 11,
    "active": 4,
    "recovery": 23,
    "damage": 90,
    "hitstun": 26,
    "blockstun": 19,
    "strength": "heavy",
    "hitboxes": [
      {
        "frames": [
          12,
          13
        ],
        "rect": {
          "x": 90,
          "y": 165,
          "w": 85,
          "h": 75
        }
      },
      {
        "frames": [
          14,
          15
        ],
        "rect": {
          "x": 100,
          "y": 220,
          "w": 80,
          "h": 80
        }
      }
    ],
    "hurtboxes": [
      {
        "frames": [
          1,
          38
        ],
        "rect": {
          "x": -65,
          "y": 5,
          "w": 105,
          "h": 315
        }
      },
      {
        "frames": [
          12,
          14
        ],
        "rect": {
          "x": 90,
          "y": 165,
          "w": 90,
          "h": 105
        }
      },
      {
        "frames": [
          15,
          19
        ],
        "rect": {
          "x": 80,
          "y": 235,
          "w": 95,
          "h": 85
        }
      }
    ],
    "properties": {
      "knockdown": true
    }
  },
  "notes": "High_Kick (215), head-high (foot 129-144 cm = y 258-288 units; hitbox y 230-310), clip 38 frames (1.25x), hit 12-15: 11/4/23. Deviation from C8 12/4/22: startup -1, recovery +1 (same 38-frame total). Knockdown per C8 (90). Hips travel 45 cm in the clip: a data step (E15) replaces it. Blend-out: foot at 66% reach at the cut, blend the last 4-6 ticks. Body hurtbox E5 for the whole move; leg box while extended. Hitstun/blockstun are placeholders; damage is the C8 number. YOK-33: boxes re-placed from the rigged model poses on their frames (bones at 200 u/m, +pads); frame timing unchanged."
}
