{
  "kind": "normal",
  "id": "ryo-medium-kick",
  "name": "Medium kick",
  "status": "proposed",
  "source": "ryo",
  "clip": "ryo-medium-kick",
  "rules": [
    "C8",
    "E1",
    "E5",
    "F2",
    "F3",
    "K3",
    "V2"
  ],
  "input": {
    "button": "MK"
  },
  "frame_data": {
    "startup": 7,
    "active": 3,
    "recovery": 14,
    "damage": 55,
    "hitstun": 18,
    "blockstun": 15,
    "hitboxes": [
      {
        "frames": [
          8,
          10
        ],
        "rect": {
          "x": 100,
          "y": 160,
          "w": 85,
          "h": 85
        }
      }
    ],
    "hurtboxes": [
      {
        "frames": [
          1,
          24
        ],
        "rect": {
          "x": -45,
          "y": 0,
          "w": 80,
          "h": 335
        }
      },
      {
        "frames": [
          7,
          14
        ],
        "rect": {
          "x": 100,
          "y": 135,
          "w": 85,
          "h": 110
        }
      }
    ]
  },
  "notes": "Re-derived from the re-timed clip (PR #41): frames_total 24, S/A/R 7/3/14. Leg is back to 31% at the cut, so it reads cleanly; a 4-tick blend-out is enough. Hitstun 18 and blockstun 15 give about +4 on hit and +1 on block (not in rules.md; the harness tunes them). Boxes in units (E1) read from clip stills; the second hurtbox is the extended limb. YOK-33: boxes re-placed from the rigged model poses on their frames (bones at 200 u/m, +pads); frame timing unchanged."
}
