{
  "kind": "normal",
  "id": "ryo-medium-punch",
  "name": "Medium punch",
  "status": "proposed",
  "source": "ryo",
  "clip": "ryo-medium-punch",
  "rules": [
    "C8",
    "E1",
    "E5",
    "F2",
    "F3",
    "K3",
    "V2"
  ],
  "input": {
    "button": "MP"
  },
  "frame_data": {
    "startup": 6,
    "active": 3,
    "recovery": 36,
    "damage": 50,
    "hitstun": 18,
    "blockstun": 14,
    "hitboxes": [
      {
        "frames": [
          7,
          9
        ],
        "rect": {
          "x": 60,
          "y": 250,
          "w": 135,
          "h": 44
        }
      }
    ],
    "hurtboxes": [
      {
        "frames": [
          1,
          45
        ],
        "rect": {
          "x": -45,
          "y": 0,
          "w": 90,
          "h": 360
        }
      },
      {
        "frames": [
          6,
          13
        ],
        "rect": {
          "x": 40,
          "y": 250,
          "w": 135,
          "h": 44
        }
      }
    ]
  },
  "notes": "Startup 6 and active 3 match C8 (6/3). Recovery is clip-derived (frames_total 45 - hit_end 9 = 36); C8 target 12. F2: the clip wins. Recommend clip-matcher cut the tail to the target (blend out) and this file be re-derived. Hitstun 18 and blockstun 14 are not in rules.md: set against the C8 recovery so on-hit advantage is about +4 and on-block about +1 once the tail is cut (until then the move is minus); the harness tunes them. Boxes in units (E1, 200/m, origin at the feet, 1.8 m = 360) read from the stills in docs/assets/clips/ryo/. Extra hurtbox = the extended limb. Hip-turn cross, chest height, full reach about 0.9 m. Clip verdict WARN (foot pivot 9 cm)."
}
